{
  "schema_version": "1.0.0",
  "evidence_id": "evd-demo-0001",
  "kind": "quote",
  "ref_artifact_id": null,
  "ref_source_id": null,
  "ref_document_id": "doc-demo-0001",
  "ref_chunk_id": "chk-demo-0001",
  "excerpt": "匿名箱机制的描述段落（摘录）。",
  "note": "来自素材原文第 2 段",
  "created_at": "2026-09-30T10:00:00+08:00",
  "updated_at": "2026-09-30T10:00:00+08:00"
}
